{
  "monat": "2026-09",
  "eingefroren_um": "2026-09-01T09:10:00+02:00",
  "eingelesen_von": "Leitung",
  "quelle": "Kalender/Dienstplan-Eingang/Eingelesen/Dienstplan_2026-09.pdf",
  "korrekturen": [
    {
      "datum": "2026-09-05",
      "rolle": "Betreuung 2",
      "erkannt": "Sam",
      "gewaehlt": "Jule"
    }
  ],
  "tage": {
    "2026-09-01": {
      "betreuung": [
        "Chris",
        null
      ],
      "kueche": "Mika"
    },
    "2026-09-02": {
      "betreuung": [
        "Sam",
        "Robin"
      ],
      "kueche": "Jule"
    },
    "2026-09-03": {
      "betreuung": [
        "Kim",
        "Sam"
      ],
      "kueche": "Mika"
    },
    "2026-09-04": {
      "betreuung": [
        "Chris",
        null
      ],
      "kueche": "Jule"
    },
    "2026-09-05": {
      "betreuung": [
        "Sam",
        "Robin"
      ],
      "kueche": "Mika"
    },
    "2026-09-06": {
      "betreuung": [
        "Kim",
        "Sam"
      ],
      "kueche": "Jule"
    },
    "2026-09-07": {
      "betreuung": [
        "Chris",
        null
      ],
      "kueche": "Mika"
    },
    "2026-09-08": {
      "betreuung": [
        "Sam",
        "Robin"
      ],
      "kueche": "Jule"
    },
    "2026-09-09": {
      "betreuung": [
        "Kim",
        "Sam"
      ],
      "kueche": "Mika"
    },
    "2026-09-10": {
      "betreuung": [
        "Chris",
        null
      ],
      "kueche": "Jule"
    },
    "2026-09-11": {
      "betreuung": [
        "Sam",
        "Robin"
      ],
      "kueche": "Mika"
    },
    "2026-09-12": {
      "betreuung": [
        "Kim",
        "Sam"
      ],
      "kueche": "Jule"
    },
    "2026-09-13": {
      "betreuung": [
        "Chris",
        null
      ],
      "kueche": "Mika"
    },
    "2026-09-14": {
      "betreuung": [
        "Sam",
        "Robin"
      ],
      "kueche": "Jule"
    },
    "2026-09-15": {
      "betreuung": [
        "Kim",
        "Sam"
      ],
      "kueche": "Mika"
    },
    "2026-09-16": {
      "betreuung": [
        "Chris",
        null
      ],
      "kueche": "Jule"
    },
    "2026-09-17": {
      "betreuung": [
        "Sam",
        "Robin"
      ],
      "kueche": "Mika"
    },
    "2026-09-18": {
      "betreuung": [
        "Kim",
        "Sam"
      ],
      "kueche": "Jule"
    },
    "2026-09-19": {
      "betreuung": [
        "Chris",
        null
      ],
      "kueche": "Mika"
    },
    "2026-09-20": {
      "betreuung": [
        "Sam",
        "Robin"
      ],
      "kueche": "Jule"
    },
    "2026-09-21": {
      "betreuung": [
        "Kim",
        "Sam"
      ],
      "kueche": "Mika"
    },
    "2026-09-22": {
      "betreuung": [
        "Chris",
        null
      ],
      "kueche": "Jule"
    },
    "2026-09-23": {
      "betreuung": [
        "Sam",
        "Robin"
      ],
      "kueche": "Mika"
    },
    "2026-09-24": {
      "betreuung": [
        "Kim",
        "Sam"
      ],
      "kueche": "Jule"
    },
    "2026-09-25": {
      "betreuung": [
        "Chris",
        null
      ],
      "kueche": "Mika"
    },
    "2026-09-26": {
      "betreuung": [
        "Sam",
        "Robin"
      ],
      "kueche": "Jule"
    },
    "2026-09-27": {
      "betreuung": [
        "Kim",
        "Sam"
      ],
      "kueche": "Mika"
    },
    "2026-09-28": {
      "betreuung": [
        "Chris",
        null
      ],
      "kueche": "Jule"
    },
    "2026-09-29": {
      "betreuung": [
        "Sam",
        "Robin"
      ],
      "kueche": "Mika"
    },
    "2026-09-30": {
      "betreuung": [
        "Kim",
        "Sam"
      ],
      "kueche": "Jule"
    }
  },
  "_meta": {
    "schema": "plan0/1",
    "angelegt_um": "2026-09-01T00:00:05+02:00",
    "angelegt_von": "App",
    "geraet": "tablet-st-pius",
    "unveraenderlich": true
  }
}
